{
  "id": 42,
  "url": "https://gitlab.com/example",
  "trigger": "example_value",
  "request_headers": {},
  "request_data": "2026-04-17T12:00:00Z",
  "response_headers": {},
  "response_body": "example_value",
  "response_status": "2026-04-17T12:00:00Z",
  "execution_duration": 42.5,
  "created_at": "2026-04-17T12:00:00Z"
}